"DisplayName";"Description";"Path"
"VNet Peering is only allowed to approved VNets.";"If you try to peer to a VNet that's not on the list of approved VNets then the action will be denied.";"https://github.com/Azure/Community-Policy/tree/master/Policies/Network/deny-peering-to-non-approved-vnets/azurepolicy.json"
"deny-ports-nsg";"deny-ports-nsg";"https://github.com/Azure/Community-Policy/tree/master/Policies/Network/deny-ports-nsg/azurepolicy.json"
"Deny Private Endpoints if not being deployed to a specific subnet";"This Policy will deny the creation of Private Endpoints if not within subnets that contain a key word.";"https://github.com/Azure/Community-Policy/tree/master/Policies/Network/deny-private-endpoint-if-not-in-specific-subnet/azurepolicy.json"
"deny-private-endpoint-in-specific-subnets-based-on-naming-convention";"deny-private-endpoint-in-specific-subnets-based-on-naming-convention";"https://github.com/Azure/Community-Policy/tree/master/Policies/Network/deny-private-endpoint-in-specific-subnets-based-on-naming-convention/azurepolicy.json"
"Deny route with next hop type internet";"Deny route with next hop type internet to ensure data loss prevention. Both creating routes as a standalone resource or nested within their parent resource route table are considered.";"https://github.com/Azure/Community-Policy/tree/master/Policies/Network/deny-route-nexthopinternet/azurepolicy.json"
"Deny route with address prefix 0.0.0.0/0 not pointing to the virtual appliance";"Deny route with address prefix 0.0.0.0/0 not pointing to the virtual appliance. Both creating routes as a standalone resource or nested within their parent resource route table are considered.";"https://github.com/Azure/Community-Policy/tree/master/Policies/Network/deny-route-nexthopvirtualappliance/azurepolicy.json"
"deny-service-endpoints-on-subnets-based-on-naming-convention";"deny-service-endpoints-on-subnets-based-on-naming-convention";"https://github.com/Azure/Community-Policy/tree/master/Policies/Network/deny-service-endpoints-on-subnets-based-on-naming-convention/azurepolicy.json"
"deny-subnet-delegation-on-subnets-containing-a-key-word";"deny-subnet-delegation-on-subnets-containing-a-key-word";"https://github.com/Azure/Community-Policy/tree/master/Policies/Network/deny-subnet-delegation-on-subnets-containing-a-key-word/azurepolicy.json"
"deny-subnets-missing-suffix";"deny-subnets-missing-suffix";"https://github.com/Azure/Community-Policy/tree/master/Policies/Network/deny-subnets-missing-suffix/azurepolicy.json"
"Deny VM creation in subnets that contain specified suffix";"This policy will deny the creation of VMs in subnets that contain a certain suffix.";"https://github.com/Azure/Community-Policy/tree/master/Policies/Network/deny-vm-creation-in-subnets-that-contain-a-specified-suffix/azurepolicy.json"
"deny-vm-vmss-and-load-balancer-from-subnet";"deny-vm-vmss-and-load-balancer-from-subnet";"https://github.com/Azure/Community-Policy/tree/master/Policies/Network/deny-vm-vmss-and-load-balancer-from-subnet/azurepolicy.json"
"VMs not in a specific subnet cannot be part of a backend pool";;"https://github.com/Azure/Community-Policy/tree/master/Policies/Network/deny-vms-not-in-a-specific-subnet-from-being-part-of-a-backend-pool/azurepolicy.json"
"deny-vnet-creation-outside-of-resource-groups-based-on-a-naming-standard";"deny-vnet-creation-outside-of-resource-groups-based-on-a-naming-standard";"https://github.com/Azure/Community-Policy/tree/master/Policies/Network/deny-vnet-creation-outside-of-resource-groups-based-on-a-naming-standard/azurepolicy.json"
"Deploy NSG rule";"This policy deploys a rule to an NSG.";"https://github.com/Azure/Community-Policy/tree/master/Policies/Network/Deploy NSG rule/azurepolicy.json"
"Deploy route to route tables";"This policy deploys a route to a route tables.";"https://github.com/Azure/Community-Policy/tree/master/Policies/Network/Deploy route to route tables/azurepolicy.json"
"Deploy NSG Flow Logs to Target Region";"This Policy will deploy NSG Flow Logs for a target region. You'll need to do a unique assignment of this Policy for each region you wish to enable NSG Flow Logs in. NSG Flow Logs require that the Storage Account used for logging be in the same region as the NSG you're enabling Flow Logs on.";"https://github.com/Azure/Community-Policy/tree/master/Policies/Network/deploy-nsg-flow-logs/azurepolicy.json"
"Create Private DNS Zone Virtual Network Link to Virtual Networks if not available";"Create Private DNS Zone Virtual Network Link to Virtual Networks if not available";"https://github.com/Azure/Community-Policy/tree/master/Policies/Network/deploy-private-dnszone-vnet-link-to-vnets/azurepolicy.json"
"deploy-private-endpoint-private-dns-zone-link";"deploy-private-endpoint-private-dns-zone-link";"https://github.com/Azure/Community-Policy/tree/master/Policies/Network/deploy-private-endpoint-private-dns-zone-link/azurepolicy.json"
"deploy-security-rule-to-existing-nsg";"deploy-security-rule-to-existing-nsg";"https://github.com/Azure/Community-Policy/tree/master/Policies/Network/deploy-security-rule-to-existing-nsg/azurepolicy-parameters.json"
"Enforce network security groups to have a DENY RDP security rule.";"Enforce network security groups to have a DENY RDP security rule.";"https://github.com/Azure/Community-Policy/tree/master/Policies/Network/deploy-security-rule-to-existing-nsg/azurepolicy.json"
"VMs in Resource Groups containing suffix must have NICs in Resource Groups with same suffix";"This Policy will require that VMs deployed into Resource Groups with a certain suffix also have their NICs deployed into Resource Groups with that same suffix.";"https://github.com/Azure/Community-Policy/tree/master/Policies/Network/enforce-nic-exemption-rg/azurepolicy.json"
"Subnets must have an NSG and that NSG must have the same suffix as the subnet";"This Policy requires that all subnets have an NSG and that the provisioned NSG shares the same suffix as it's attached Subnet.";"https://github.com/Azure/Community-Policy/tree/master/Policies/Network/enforce-subnets-must-have-nsg-and-nsg-must-have-same-suffix-as-subnet/azurepolicy.json"
"Enforce Firewall Policy DNS servers";"This policy prevent settings non authorized dns servers for firewall policies.";"https://github.com/Azure/Community-Policy/tree/master/Policies/Network/enforce_azfw_dns_servers/azurepolicy.json"
"Enforce VNET DNS servers";"This policy prevent settings non authorized dns servers for vnets.";"https://github.com/Azure/Community-Policy/tree/master/Policies/Network/enforce_vnet_dns_servers/azurepolicy.json"
"modify-inject-Routes-into-exsiting-Route-Table";"modify-inject-Routes-into-exsiting-Route-Table";"https://github.com/Azure/Community-Policy/tree/master/Policies/Network/modify-inject-Routes-into-exsiting-Route-Table/azurepolicy.json"
"Adds route with address prefix 0.0.0.0/0 pointing to the virtual appliance in case there is none.";"Adds route with address prefix 0.0.0.0/0 pointing to the virtual appliance in case there is none. Best combined with policy deny-route-nexthopvirtualappliance to ensure the correct IP address of the virtual appliance.";"https://github.com/Azure/Community-Policy/tree/master/Policies/Network/modify-routetable-nexthopvirtualappliance/azurepolicy.json"
"Adds the default network security group to subnets in case there is none.";"Adds the default network security group to subnets in case there is none. Nothing happens when another network security group is already associated with the subnet.";"https://github.com/Azure/Community-Policy/tree/master/Policies/Network/modify-subnet-nsg/azurepolicy.json"
"Adds the default route table to subnets";"Adds the default route table to subnets. Other route tables are replaced with the default route table.";"https://github.com/Azure/Community-Policy/tree/master/Policies/Network/modify-subnet-routetable/azurepolicy.json"
"Vnet peering disallowed outside subscription";"No network peering can be associated to networks outside the current subscription.";"https://github.com/Azure/Community-Policy/tree/master/Policies/Network/peering-outside-disallowed/azurepolicy.json"
"Prevent cross subscription Private Link";"This policy prevents private link between subscriptions.";"https://github.com/Azure/Community-Policy/tree/master/Policies/Network/Prevent cross subscription Private Link/azurepolicy.json"
"Prevent cross tenant Private Link for acr";"This policy prevents private link between tenants for acr.";"https://github.com/Azure/Community-Policy/tree/master/Policies/Network/Prevent cross tenant Private Link for acr/azurepolicy.json"
"Prevent cross tenant Private Link for aks";"This policy prevents private link between tenants for aks.";"https://github.com/Azure/Community-Policy/tree/master/Policies/Network/Prevent cross tenant Private Link for aks/azurepolicy.json"
"Prevent cross tenant Private Link for ampls";"This policy prevents private link between tenants for ampls.";"https://github.com/Azure/Community-Policy/tree/master/Policies/Network/Prevent cross tenant Private Link for ampls/azurepolicy.json"
"Prevent cross tenant Private Link for eventgrid domains";"This policy prevents private link between tenants for eventgrid domains.";"https://github.com/Azure/Community-Policy/tree/master/Policies/Network/Prevent cross tenant Private Link for eventgrid domains/azurepolicy.json"
"Prevent cross tenant Private Link for eventgrid topics";"This policy prevents private link between tenants for eventgrid topics.";"https://github.com/Azure/Community-Policy/tree/master/Policies/Network/Prevent cross tenant Private Link for eventgrid topics/azurepolicy.json"
"Prevent cross tenant Private Link for key vault";"This policy prevents private link between tenants for key vault.";"https://github.com/Azure/Community-Policy/tree/master/Policies/Network/Prevent cross tenant Private Link for key vault/azurepolicy.json"
"Prevent cross tenant Private Link for storage";"This policy prevents private link between tenants for storage.";"https://github.com/Azure/Community-Policy/tree/master/Policies/Network/Prevent cross tenant Private Link for storage/azurepolicy.json"
"Prevent internet routes in route tables";"This policy prevents next hop internet in route tables.";"https://github.com/Azure/Community-Policy/tree/master/Policies/Network/Prevent internet routes in route tables/azurepolicy.json"
"Prevent subnets without NSG";"This policy prevents subnets without an NSG attached to them.";"https://github.com/Azure/Community-Policy/tree/master/Policies/Network/Prevent subnets without NSG/azurepolicy.json"
"Prevent subnets without Route Table";"This policy prevents subnets without a UDR attached to them.";"https://github.com/Azure/Community-Policy/tree/master/Policies/Network/Prevent subnets without Route Table/azurepolicy.json"
"require-specific-route-on-udr";"require-specific-route-on-udr";"https://github.com/Azure/Community-Policy/tree/master/Policies/Network/require-specific-route-on-udr/azurepolicy.json"
"Virtual Machine NIC must have NSG";"This policy prevents NIC attached to a vm to not have an NSG.";"https://github.com/Azure/Community-Policy/tree/master/Policies/Network/Virtual Machine NIC must have NSG/azurepolicy.json"
"VNet Peering is only allowed to approved VNets";"This policy denied you from peering to a VNet that's not on the list of approved VNets.";"https://github.com/Azure/Community-Policy/tree/master/Policies/Network/VNet Peering is only allowed to approved VNets/azurepolicy.json"
